<?xml version="1.0" encoding="UTF-8"?>
<!--Sample XML file generated by XMLSpy v2014 rel. 2 sp1 (x64) (http://www.altova.com)-->
<Operator xmlns:xsi="http://www.w3.org/2001/XMLSchema-instance" xsi:noNamespaceSchemaLocation="operator.xsd">
	<Log>
		<Category>op</Category>
		<Level>debug</Level>
		<LogFileName>operator.log</LogFileName>
		<LogFilePath>./</LogFilePath>
		<LogFileMaxSizeMB>5</LogFileMaxSizeMB>
		<MaxLogFiles>2</MaxLogFiles>
		<Layout>%d{%y-%m-%d %H:%M:%S.%l}| %-6p | %-15c | %m%n</Layout>
	</Log>
	<Manager>
		<Log>
			<Category>mng</Category>
			<Level>notice</Level>
		</Log>
		<Dreamer>
			<Log>
				<Category>drm</Category>
				<Level>notice</Level>
			</Log>
		</Dreamer>
		<Executor>
			<Log>
				<Category>xec</Category>
				<Level>notice</Level>
			</Log>
		</Executor>
	</Manager>
</Operator>
